Author,Body,Reply to,Message Replying to,Permalink,Score,TimeStamp,Year,Source
durianboy19,star living,-,-,/r/singapore/comments/l2y5er/rsingapore_random_discussion_and_small_questions/gka6hnf/,2,23/1/2021 02:36,2021,Reddit
KimJiHoon,"I got my bed, dining table and chairs from star living. Quite affordable. Most importantly you both agree on a theme then work from there easier if not then the ikea package not so bad idea too.",-,-,/r/singapore/comments/kdvkhi/rsingapore_random_discussion_and_small_questions/gg0e8w8/,1,16/12/2020 07:25,2020,Reddit
singapore1211,"well, check out star living- decent pricing- should be around 1k - 1.5k.. or buy ikea ones and change it to leather",-,-,/r/singapore/comments/k5jlln/rsingapore_random_discussion_and_small_questions/gegfq0j/,2,3/12/2020 04:40,2020,Reddit
KimJiHoon,star living,-,-,/r/singapore/comments/jpzdte/rsingapore_random_discussion_and_small_questions/gblx2om/,1,8/11/2020 13:07,2020,Reddit
KimJiHoon,You can try star living,-,-,/r/singapore/comments/hxb287/rsingapore_random_discussion_and_small_questions/fz677ui/,2,25/7/2020 05:48,2020,Reddit
QLevi,"My parents got excellent wedding gifts. All these are almost 40 years old:
 
 
 
 1) Takahi slowcooker. It only has three settings - Off, High, Auto.
 
 
 
 2) Zojirushi boiler with only Boil and Warm settings. I'm not certain how healthy it is to use such an old boiler but we're not dead yet so... 
 
 
 
 3) Le creuset pot that looks good as new. We baby it though. 
 
 
 
 Various Scanteak furniture that are 20+ years old. Still solid despite our v rough treatment (e.g. water stains, scratches). 
 
 
 
 Surprisingly, a STAR Living junior wardrobe made of shitty material has lasted us almost 30 years. It's refusal to break down = uncle still using a kiddy pastel blue wardrobe. We stack 10kg luggages on the thing all the time and it's still perfectly fine? I hate it so much.",-,-,/r/singapore/comments/hw7nx2/what_are_some_brandsshops_in_sg_that_are_buy_for/fyygtin/,13,23/7/2020 06:49,2020,Reddit
niteblane,"fans can try malaysia, buy alr ask contractor install. 
 
 
 
 furniture are mostly taobao+ikea
 
 
 
 sofa star living is fine. just get soemthign you like ? 
 
 
 
 electronics we went with those under hdb electrical stores. tend to be cheaper than best denki/courts and stuffs",-,-,/r/singapore/comments/b0dsd8/rsingapore_random_discussion_and_small_questions/eiehmwu/,1,13/3/2019 02:22,2019,Reddit
KimJiHoon,"for furniture we got all under one roof at star living (beds,sofa,dining table). As for major electronics we got it from gain city ang mo kio main branch coz it has all the connections needed. (TV,Kitchen stove, air vent,oven and 3 aircons)",-,-,/r/singapore/comments/b0dsd8/rsingapore_random_discussion_and_small_questions/eieefsu/,1,13/3/2019 01:42,2019,Reddit
mysuperpowerissleep,Comfort furniture and star living (the Tampines star living is the biggest one),-,-,/r/singapore/comments/aapjt0/rsingapore_random_discussion_and_small_questions/ecvh3ml/,1,30/12/2018 14:40,2018,Reddit
burgersk,"If you live near the Buona Vista area, there’s this shop that sells lots of cool and nice decorations at Star Vista. It’s called home&amp;living (not sure abt this one) and is a few shops down the J-Mart",-,-,/r/singapore/comments/9kahla/rsingapore_random_discussion_and_small_questions/e6ypbd4/,4,1/10/2018 12:20,2018,Reddit
KimJiHoon,maybe you can research on which shop you wanna buy them from and see their credit card promotion then get the credit card. the other time we went star living and take advantage on the 0% instalments and manage to balance it out. within 6 months everything been paid for!,-,-,/r/singapore/comments/8vmlni/what_are_the_recent_credit_card_promotions_to_go/e1p0nnq/,2,3/7/2018 01:59,2018,Reddit
orgastronaut,"Picket &amp; Rail
 
 
 
 Novena Furniture
 
 
 
 Star Living 
 
 
 
 Castlery",-,-,/r/askSingapore/comments/j78ghp/does_anyone_know_where_i_can_get_new_affordable/g8au4qg/,1,10/10/2020 09:15,2020,Reddit
gretsall,"Yes, most room rentals are furnished with essentials for tenants’ convenience. Bed, small desk, wardrobe etc. Most landlords wouldn’t go through the hassle of cabling LAN from router to the spare room. Hence, it’s the norm to provide just wifi. Most of us rent out spare rooms, so you may be living with the landlord. Get to know them &amp; their rules before committing.
 
 
 
 I used to work in One-North area too :) I’d recommend staying in the west. If you want to save more, find a house that isn’t near malls, or a little distance away from MRT(bus transfer). You can go to food centres &amp; supermarkets in residential areas. And commute a few stops to malls for shopping/movies on days off. The places I recommend below have malls near the MRT. 
 
 -Buona Vista (Mall: Star Vista/no cinema)
 
 -Jurong East (3 malls. Busy area)
 
 -Bukit Batok (West Mall)
 
 -Boon Lay (Mall: Jurong Point)
 
 
 
 You actually earn more than me after tax. I’m a junior office worker. You could get by fine, with 650-800SGD rental.",-,-,/r/askSingapore/comments/b0jsbr/moving_to_singapore_for_a_job_have_a_question/eig11qm/,1,13/3/2019 17:41,2019,Reddit
heedyouradvice,"thanks for the reply JR8, but personally i had some pretty bad experience buying from Ikea..bubbles forming on the surface, shaky cabinet, veneer splitting..therefore would like to buy solid wood furniture this time and from another source.

then again, i'm still months away from moving in to my new home. will be visiting the big box stores Star living, courts, etc. and hopefully find what i want!

i'm just wondering whether there are any ""lesser known"" stores but selling beautiful solid wood furniture thus for this post..

thanks again JR8, appreciate your help!",JR8,"We got our dining room chairs from IKEA. A simple/classic design, made from solid birch (a hardwood) with upholstered seat that could be removed so the covers could be removed and laundered. Very solidly made, looked great, relatively inexpensive for what they were.
Like these -> http://www.ikea.com/sg/en/catalog/products/30162109/
$55, what a bargain!
A dining table is going to be more expensive, look for extendible or 'drop-leaf' tables that can be extended when the seating space is required and otherwise folded down or away (if you need to).

I'm quite a fan of IKEA. Some product lines are great (like those chairs) and some tend to be crappy (IME arm-chairs/sofas)
",https://forum.singaporeexpats.com/viewtopic.php?t=110354,0,08/02/2016 12:04pm,2016,Singapore Expat
the lynx,"Star Living at Labrador Park has lounge chairs like you mentioned. Not sure about the pricing.

http://www.starliving.com.sg/contact-us ... ranch.html",scooter,"Checked Ikea but only wooden/plastic models which require a lounge chair pad are available, which I didn't really want. Any ideas on a discount outdoor store or home center-type store, even over in Malaysia?",https://forum.singaporeexpats.com/viewtopic.php?t=102421,0,17/06/2014 03:48pm,2014,Singapore Expat
ironut,So which furniture shop is endorsed here? Star Living kym? I like their new range of Scandi furniture,,,,,"18-12-2016, 10:11 AM",2016,HWZ
Gixxerfied,"I got 4 chrairs and a nested table set from star living, dining table(Using for work desk) and sofa from castlery...",,,,,"18-12-2016, 10:18 AM",2016,HWZ
Bunny2016,"Some renotalk blogs buy Star Living. The furniture look nice. My sofa from Furniture Club Park Mall during GSS sale. My bed is carpentry. Dining table I want the Pomelo table but no sales For guest room, I probably get from Castlery. The rest of the furniture maybe custom made. Have not decide on laminate. Is it better to have visual uniformity? As in all the laminates in the flat have to match or the same ones?",ironut,So which furniture shop is endorsed here? Star Living kym? I like their new range of Scandi furniture,,,"18-12-2016, 10:20 AM",2016,HWZ
hwaa,"castlery, comfortdesign, star living. shld be quite okay. but its peasant range stuffs for fellow peasants.",ironut,So which furniture shop is endorsed here? Star Living kym? I like their new range of Scandi furniture,,,"18-12-2016, 10:23 AM",2016,HWZ
pills,"OMG, don't scare me le.. Infested by termites? How did that happen? Comfort Furniture indeed has some nice pieces. Even Star Living for cheaper ones. Some constant sale going on.",,,,,"21-08-2013, 10:04 AM",2013,HWZ
mskarah,"Don't buy from bedandbasics.sg no matter what. Their 100-day return policy is ********. They sent me a stained and drooping sofa and refuse to refund me. Said it's cos the item is no longer in its original packaging. How the H do you inspect a sofa without removing its packaging?! On top of that, they are very very rude and niao and keep trying to fleece me and my hubby. GO FORTYTWO instead. They're really decent and the customer service is topnotch. They just didn't have the kind of sofa we wanted. Bought from Star Living in the end, which was also pretty cool. They were nice at least and helpful, and the quality is of some standard.",,,,,"19-04-2018, 02:35 PM",2018,HWZ
mskarah,"Don't buy from bedandbasics.sg no matter what. Their 100-day return policy is ********. They sent me a stained and drooping sofa and refuse to refund me. Said it's cos the item is no longer in its original packaging. How the H do you inspect a sofa without removing its packaging?! On top of that, they are very very rude and niao and keep trying to fleece me and my hubby. Try to make us accept an exchange but the quality and design is unacceptable. And their attitude is the worst. GO FORTYTWO instead. They're really decent and the customer service is topnotch. Every time I've bought from them, I've had a good experience. They just didn't have the kind of sofa we wanted. Bought from Star Living in the end, which was also pretty cool. They were nice at least and helpful, and the quality is of some standard.",,,,,"19-04-2018, 02:29 PM",2018,HWZ
mskarah,"Don't buy from bedandbasics.sg no matter what. Their 100-day return policy is ********. They sent me a stained and drooping sofa and refuse to refund me. Said it's cos the item is no longer in its original packaging. How the H do you inspect a sofa without removing its packaging?! On top of that, they are very very rude and niao and keep trying to fleece me and my hubby. GO FORTYTWO instead. They're really decent and the customer service is topnotch. They just didn't have the kind of sofa we wanted. Bought from Star Living in the end, which was also pretty cool. They were nice at least and helpful, and the quality is of some standard.",,,,,"19-04-2018, 02:34 PM",2018,HWZ
zercab,"Hi OCBC, is Star living eligible for 10x? Thanks",,,,,"25-02-2019, 02:45 PM",2019,HWZ
OCBC Bank,"Hi zercab, Star Living transactions will not be eligible for 10X OCBC$. ^DG",zercab,"Hi OCBC, is Star living eligible for 10x? Thanks",,,"25-02-2019, 03:37 PM",2019,HWZ
mskarah,"Don't buy from bedandbasics.sg no matter what. Their 100-day return policy is ********. They sent me a stained and drooping sofa and refuse to refund me. Said it's cos the item is no longer in its original packaging. How the H do you inspect a sofa without removing its packaging?! On top of that, they are very very rude and niao and keep trying to fleece me and my hubby. GO FORTYTWO instead. They're really decent and the customer service is topnotch. They just didn't have the kind of sofa we wanted. Bought from Star Living in the end, which was also pretty cool. They were nice at least and helpful, and the quality is of some standard.",,,,,"19-04-2018, 02:27 PM",2018,HWZ
windwaver,"It's good to share, thanks.",mskarah,"Don't buy from bedandbasics.sg no matter what. Their 100-day return policy is ********. They sent me a stained and drooping sofa and refuse to refund me. Said it's cos the item is no longer in its original packaging. How the H do you inspect a sofa without removing its packaging?! On top of that, they are very very rude and niao and keep trying to fleece me and my hubby. GO FORTYTWO instead. They're really decent and the customer service is topnotch. They just didn't have the kind of sofa we wanted. Bought from Star Living in the end, which was also pretty cool. They were nice at least and helpful, and the quality is of some standard.",,,"19-04-2018, 04:22 PM",2018,HWZ
Henabi,You can try star living... I bought my dining set from there,,,,,"01-10-2016, 09:10 AM",2016,HWZ
convictionn,Any reviews? I've been told to avoid star living by many people!,Henabi,You can try star living... I bought my dining set from there,,,"01-10-2016, 09:13 AM",2016,HWZ
Littledragonpapertiger,"I was told not to buy from Harvey Norman, Nova, etc. In fact almost every furniture shop got negative review. But what to do? Choice are really limited if you exclude all these. Also thinking of whether to buy now or wait to see if got Christmas sale.",convictionn,Any reviews? I've been told to avoid star living by many people!,,,"01-10-2016, 09:38 AM",2016,HWZ
Yasha_Lim,"hi All, just wish to warn you people if you want to buy furniture from the Star Living furniture. i bought a set of furnitures from Star Furniture at a cost of about S$5,000 in mid 2011 and I was informed that the furnitures will be given 1-year of warranty. little did i know that immeidately after the warranty period, the furnitures (sofa set, coffee table, TV table) started to develop cracks. i immediately called the company to complain about this and do you know what they replied me? they told me that as the warranty has expired, i would need to pay for them to come and investigate and i would need to pay for all the repair work if i so wish. after i told them that i will complain to CASE and expose them in the media, they quickly replied that they will waive the cost for them to investigate but i will still need to pay for all repair work. the purpose of this thread is to warn you folks out there who is contemplating to purchase furnitures. if you wish to purchase furnitures that will last only for the very short-term, Star Furniture will be right for you. by the way, they have 4 lines of brand and are as follows: 1) Zen Tradition Living; 2) Mondi Lifestyle Gallery; 3) Lucano; and 4) Star Living.",,,,,"19-01-2013, 11:14 PM",2013,HWZ
hwaa,star living ok bah. if me i will avoid those at sungei kadut.,,,,,"01-10-2016, 11:39 AM",2016,HWZ
Langrisser999,Star living things furniture like not bad but the price a bit high.,1993newbie,"Yup, mine mostly ikea & star living things.",,,"24-12-2020, 12:37 PM",2020,HWZ
PeckingBird,Eh? Star living in Italy? Why he got problem with u living in Aussie?,hardwriter,"I hate to agree with Rick kor koe on this but Rick is probably 99% right. Nowadays you see the way the department of home affairs people reject people is really straightfoward and merciless. Even those of medical professions are not spared unless you are really a medical doctor. Probably if Starmerck WANTS to move over from Italy to Oz? Yes, then will have chance since he is working in ITALY as a lor kun nao.",,,"23-01-2021, 05:23 AM",2021,HWZ
hardwriter,Since when i said I ever was living in Oz? Why chiu nao then know Dr starmerck kor kor is living in Italy? Mai sng siao sng siao hokay. People is high ses doctor but you shouldn't take his word I am in Oz.,PeckingBird,Eh? Star living in Italy? Why he got problem with u living in Aussie?,,,"23-01-2021, 05:32 AM",2021,HWZ
mskarah,"Don't buy from bedandbasics.sg, they're really terrible. Their 100-day return policy is ********. They sent me a stained and drooping sofa and refuse to refund me. Said it's cos the item is no longer in its original packaging. How the H do you inspect a sofa without removing its packaging?! On top of that, they are very very rude and niao and keep trying to fleece me and my hubby. Refuse to come and pick up the damn couch until we agree to pay them $80. GO FORTYTWO instead. They're really decent and the customer service is topnotch. They just didn't have the kind of sofa we wanted. Bought from Star Living in the end, which was also pretty cool. They were nice at least and helpful, and the quality is of some standard.",,,,,"19-04-2018, 02:32 PM",2018,HWZ
Mancunian2,taobao can ship to SG?,missotah,"keep it up, not easy. Me too, i sometime change my mind and change design and colour. Think for very long. Not as decisive as many of you all and sometime forget bring my taste out. Gixxerfied, star living chair are up to date, i think they have their own supply in china, cos. i see similar design on tb, i like 3 star living chair but only managed to find similar on tb, no same colour and same chair pvc cover. http://www.starliving.com.sg/e-shop/...ing-chair.html http://www.starliving.com.sg/e-shop/...ing-chair.html anyone see these on tb, kind give me the link, lol only wanna get these with prime else not worth shipping over and install myself. overpriced item http://www.starliving.com.sg/e-shop/...ing-chair.html tb: https://item.taobao.com/item.htm?id=...44&toSite=main anyone buy from hipvan before? https://www.hipvan.com",,,"11-08-2016, 12:12 AM",2016,HWZ
Gixxerfied,"Ya, can find similar items in Taobao.. Hipvan ar? That time was looking at them then my wife also found similar design in Taobao , hipvan price like hype up leh..",missotah,"keep it up, not easy. Me too, i sometime change my mind and change design and colour. Think for very long. Not as decisive as many of you all and sometime forget bring my taste out. Gixxerfied, star living chair are up to date, i think they have their own supply in china, cos. i see similar design on tb, i like 3 star living chair but only managed to find similar on tb, no same colour and same chair pvc cover. http://www.starliving.com.sg/e-shop/...ing-chair.html http://www.starliving.com.sg/e-shop/...ing-chair.html anyone see these on tb, kind give me the link, lol only wanna get these with prime else not worth shipping over and install myself. overpriced item http://www.starliving.com.sg/e-shop/...ing-chair.html tb: https://item.taobao.com/item.htm?id=...44&toSite=main anyone buy from hipvan before? https://www.hipvan.com",,,"11-08-2016, 06:46 AM",2016,HWZ
Asgsgsg,"Oh dear, where is your child studying now? I thought Xin Hua primary is located at hougang...? I will not recommend any ID to you... haha.. after talking to a few IDs, I feel that they just want to close sales and get commission... I decided to buy furniture first to move in. Just buying furniture already cost a bomb at times...haha Since yours is 3 bedder, you will have a larger space and should be able to buy suitable furniture to fit in for quick moving solution. I saw a few junior bedrooms set all in one structure at Star Living located at Tampiness Space which maybe suitable to your child's needs and liking since he/she is in primary school.For furniture, it will be easier to find those shops like star living as they have ready stock for common furniture. With young children, it is good to keep house as simple as possible as you will realise there will more and more stuffs piling up as time passes...lol.. cleaning is biggest headache.",chenyumuhua,"I bought the house on 2016 while the agent told me it will be ready to collect key on 4th quarter of 2018, because we need to apply the xinhua primary school, but finally failed. Now the school start, we are very inconvenience to go to school while waiting to collect the key. Any good ID recommended, I think we only can simply renovate since rush to move in to solve the school problem",,,"07-01-2019, 06:49 PM",2019,HWZ
Gixxerfied,"Now that i'm out of picture to post(All on home pc, nv upload ytd) so this post would be on the appliances, furniture for the house.. First up, Wet items(From Hoe Kee): - Blanco Naya 6 + Tape combo - Roz round basin(Both toilet) - Grohe Euphoria 180 Rainshower set(MBR) - Grohe Bauloop High Body Mixer Tap(Both toilet basin) - Grohe Ntempesta Shower Rail(Common) - Grohe Bauloop Bath mixer(Common) - Grohe Bidet Spray(Trigger Spray for both toilet) Those items for towel, toilet roll, those shampoo holder all from Ikea cheap cheap.. Kitchen Stuff: - Mayer MMGH770(Gas Hob) - Mayer MMBCH900(Chimney Hood) - Morphy Richard Redefine Hot Water Dispenser - Zojirushi NS-ZAQ18(Rice Cooker) - Hitachi AV200E(Microwave Oven) - Sharp SJ-PD58V-BK(Fridge) - Sony KD55 X8500D with Sony Pivot Wall Mount - Dyson DC47i + V6 SV03 - Samsung WA10J5750SP(Washing Machine) - Mitsubishi MXY3A28VAR7(Compressor), MSYGE10VAR2(Fan coil for both bedrooms), MSYGE18VAR2(Living Rm) - KDK U48FP Ceiling Fan - Bomb Shelter Rack(Boltless L Shape 170cm length, 120cm width, 210cm height from RackSG) Furniture: - Castlery Miller 1.8m Dining Table(Use it for workstation) - Castlery Tana Sofa Sectional Right Hand Facing(In Navy Blue) - Ikea Hemnes King size bedframe + Lonset slatted bed base - Ikea Hovag King Mattress with TUSSÖY Mattress Pad - Daffy Dining Chairs(Use for study table from Star Living) - Cathy Bar Chair(For Dining Table) Off my mind, can only rem this.. Tonight then can consider with that Sat afternoon picture where some installation came in..",,,,,"25-07-2016, 12:21 PM",2016,HWZ
Vegitto,"Oh okie. Thank u. I had a tumble in my tertiary edu, and thus I can only do lower end pmet jobs, plus a few yrs back someone I was doing hp exporting biz with ran off with all the money, only managed clear all the debts incurred from that biz last yr. So still quite broke now... So 2 yrs later after get key, not sure if able to save enough for basic reno + furniture for my new place",1993newbie,I buy mostly from Ikea AsIs department & from Star Living. Not bad design too. Affordable,,,"27-05-2020, 10:03 PM",2020,HWZ
focus1974,morale of the story is.... dont give small local company chance.. always go to the bigger local companies ...even though they are not the cheapest.. i always buy from lorenzo... and courts... .very reliable. .also got one.. i think is A star Living.. the big furniture shop near alexandra mrt area Same for cars... buy from the biggest PI and AD... not the small time PIs,,,,,"11-03-2021, 09:40 AM",2021,HWZ
1993newbie,"Yup, mine mostly ikea & star living things.",Langrisser999,"they heard is HDB 2 room, they already sian. So if your inside spend alot to reno very swee also no use. Hence be realistic, just buy cheap furniture from ikea can liao. No need to reno like palace.",,,"24-12-2020, 12:27 PM",2020,HWZ
Gixxerfied,"Depending on the stuff u getting, should prepare around 50-55k for everything including reno.. The list, - Dyson is the vacuum cleaner which consist of a DC47i + V6 SV03 Cordless - HDB Misc is the SC&C fees i paid during key collection - Hoe Kee is the rainshower, basin, taps, kitchen sink + tap - The Ikea(Kelvin) is my friend help me buy the 2 toilet roll holder - Megaman Tracklight is the 2 u see infront of my wardrobe + studyroom.Actual cost is $224. - Both Ikea Misc consist of alot of items..Bedsheet + Quilt Cover + Quilt for both beds, pillows, small items, dustbin, some rack, small laundry cabinet etc etc - Gerton Table legs is the one u see on my bar table - Star Living consist of 4 chairs namely 2 Cathy Barchair + 2 Daffy Study table chairs - The $73.30 Ikea also small items. - BS Rack is the Bomb Shelter Rack from RackSG - Lighting is after conversion from MYR Edit: Never add in my Eubiq Powertrack which cost me $2099 and also a Sony CT380 Soundbar i purchased ytd..",zaviour,Thanks2 yeah sure for a reference next time so can agak-agak for budgeting...,,,"01-08-2016, 09:12 AM",2016,HWZ
missotah,"keep it up, not easy. Me too, i sometime change my mind and change design and colour. Think for very long. Not as decisive as many of you all and sometime forget bring my taste out. Gixxerfied, star living chair are up to date, i think they have their own supply in china, cos. i see similar design on tb, i like 3 star living chair but only managed to find similar on tb, no same colour and same chair pvc cover. http://www.starliving.com.sg/e-shop/...ing-chair.html http://www.starliving.com.sg/e-shop/...ing-chair.html anyone see these on tb, kind give me the link, lol only wanna get these with prime else not worth shipping over and install myself. overpriced item http://www.starliving.com.sg/e-shop/...ing-chair.html tb: https://item.taobao.com/item.htm?id=...44&toSite=main anyone buy from hipvan before? https://www.hipvan.com",Repsol_2,"I cannot afford la. My hse design bare minumum. All design by myself, i ask then do this n that from color, material to design. I oversee whole thing.",,,"11-08-2016, 12:03 AM",2016,HWZ