,Body,Year,Positive,Neutral,Negative,Compound
0,"oh, if you are thinking how good scanteak appears, you might also want to give them a miss. i've been fooled by them for years (although i've never bought anything as their prices to too inflated - i didn't realize how much until the run-up to cny this year). i love the run-up to cny as i am a recycler type of woodworker. i love people throwing away old hardwood furniture which i break down and repurpose. this year i came across a teak bedframe with nice long wood rails down each side. clearly marked with the scanteak logo into the wood at one end of each rail. after bringing them back to the house i started to removed the inner slat rails and low and behold, those bed rails are not solid wood at all but a very heavy dense type of particleboard (not quite mdf but close) that has real teak veneer on all sides/edges and end grain, covering all traces of the false centres. the stuff is garbage. buyer beware.",2021,0.071,0.894,0.035,0.7334
1,"courts stuff is terrible in my opinion. have a look but i got a few mid-range pieces from there that looked decent on the showroom, but turned out to be of low quality. it's the great singapore sale right now. you can find deals at nicer places. try 'v.hive' at plaza singapura which is 1 step up from ikea, more modern style compared to courts, or maybe even scanteak if they are having a sale (though their stuff typically runs 2 steps up from ikea's best line).",2015,0.159,0.792,0.049,0.9274
2,"another place to take a look around is scanteak. again, this is not a top quality furniture store (i would not recommend to buy anything there for the outdoor), neither the cheapest one but it offers some better balance to the ikea's offer. we decided to have our own furniture ca 5y ago and it took us a few good months to roughly complete the task. we are also a price cautious (low-end expats) but we simply wanted to have something that we like and this something should also last a bit longer. with this conditions it is rather difficult to buy all the stuff in a single place so we just checked around in a number of places and picked up what we wanted. if this matters we prefer rather simplistic, zen-like style. the major concentrations of furniture shops are (at least 5y ago): - the furniture mall (off the beach rd) - the sungei kadut district - probably over dozens of shops all together half of them along sungei kadut ave - dempsey area shops (already gone) we were disappointed with the furniture mall. it was very expensive for anything we liked over there. all together this is roughly the list of the places we bought some furniture from: 1) http://unicane.com (abaca sofa and chairs) 2) scanteak (few minor tower chests of drawers, all teakish, each piece below $100 and most of them looking like they were made by a drunk carpenter) 3) a lot of stuff from ikea (beno cd racks, expedit shelves) 4) furniture mall (rather expensive, some custom made teak furniture in a place i could not recommend because we almost sued them for the job done and they almost sued me for alleged defamation). 5) dempsey area, holland village, furniture mall (minor furniture, side tables etc.)",2014,0.066,0.877,0.057,0.6022
3,check with scantech: http://www.scanteak.com.sg/ this set: was for ~$s680. you can buy 2 chairs and a smaller table what should fit into your budget.,2011,0.106,0.894,0.0,0.3612
4,wooden top and metal frame sounds like not really a common combination. for all wooden table you should really have no problems to google something out. first in a raw: http://www.scanteak.com.sg/catalogue%3eoutdoor%3etables,2010,0.124,0.72,0.157,-0.2828
5,for mid-upper range furniture you can do scanteak or pickett & rail.,2010,0.0,1.0,0.0,0.0
6,scanteak is more teak style while i am thinking more of modern minimalistic and/or leather furnishing?,2010,0.0,1.0,0.0,0.0
7,"actually, scanteak is scandanavian design but using teak instead of birch or oak as they normally do. leather furnishings? novena usually carries a reasonable selection of italian leather furnishings.",2010,0.0,1.0,0.0,0.0
8,"try the scanteak, i think that's the name of the store",2009,0.0,1.0,0.0,0.0
9,haha completely forgot that there was this thread. i'm still using my sitoca desk but always looking out for a new desk. i got to scanteak for a quote on a piece of pinewood 180cm x75cm at $700. thought i could maybe get the top there and legs from the galant. but damn solid wood is expensive.,2013,0.106,0.833,0.062,0.1406
10,"funan not selling the sitoca series that i want.... shoot them an email if they are able to customise for me and pricing... but doubt they will entertain me as they are doing for coporate business, and may not do for end-users like me... but, hoping for a reply frm them..",2013,0.168,0.748,0.084,0.714
11,"i think both places services quite bad. maybe its just our country la, tbh. thats why go their warehouse showroom. then see what they clearing and they can check the stocks also. i think scanteak one is here 60 sungei kadut dr, 729569 picket & rail 25 tagore lane s787602",2016,0.0,0.924,0.076,-0.5849
12,"the worst was at hn when i was trying out beds, the guy asked where our house was and very quickly moved on to the most ridiculously priced beds. i then quickly left the shop.",2016,0.0,0.82,0.18,-0.7778
13,hello! im about to receive my card soon! i am going to get some scanteak furniture from isetan scotts. is it under departmental store to get 10x? thanks alot!,2017,0.123,0.877,0.0,0.5826
14,"hi takesflight, we have recently reviewed this merchant and will be adding isetan to the list of eligible merchants to receive the 10x ocbc$. do drop us a pm if you need us to check on your transaction. ^dg",2017,0.0,0.946,0.054,-0.2732
15,"is solid wood furniture. like scanteak, namu wood furniture, wihardja furniture, picket and rail worth it?",2021,0.316,0.684,0.0,0.6124
16,"personally i think furniture like console with cabinet, desks and dining table should go for solid wood. others like window side or pedestal cabinets can go for compressed wood if you intend to replace in future.",2021,0.171,0.829,0.0,0.6808
17,"may i suggest to those going to ikea for their wardrobes : - keep the width to 60cm - esp if you are buying the budget ones with thin shelves - avoid the flimsy mdf shelves, these will flex easily ready made ones from scanteak or other companies using real wood aren't a lot more if you want cheap and good. better custom made ones use thick plywood or solid wood ($$$). the other option is from ximula or alumix. they can take pretty heavy weights and the budget version is quite affordable.",2020,0.174,0.804,0.022,0.9163
18,"just to add: dont place ikea wardrobes under the aircon unit. last time, my aircon leaked and water dripped onto wardrobe. the wood bloated... changed to rosewood furniture, water proof",2020,0.0,0.927,0.073,-0.3182
19,"are ikea quality so bad? looking to get one of their customized wardrobe (pax - https://www.ikea.com/sg/en/p/pax-war...ite-s69180598/ ) and the wood they used: materials wardrobe frame particleboard, fibreboard, particle- and fibreboard with honeycomb paper filling (100% recycled paper), paper foil, laminate, melamine foil, plastic edging, plastic edging are those decent enough or got other better ones out there?",2020,0.048,0.872,0.08,-0.4499
20,"since you already have tk, can try the one sold by scanteak, it's even cheaper. don't know why, i feel it's too soft so din't take that. maybe it's psychological. emailed scanteak and they say their foam is also made from dunlop process. it's 3in latex top vs 4in latex top from tk.",2018,0.067,0.933,0.0,0.3818
21,scanteak furniture good ? those scanteak look alike from taobao also not cheap leh,2016,0.195,0.805,0.0,0.4404
22,i m look at it too... if my budget allows i will buy these... but not sure anyone got buy not thou...,2016,0.0,0.88,0.12,-0.3491
23,scanteak is good but its not cheap.,2016,0.245,0.755,0.0,0.2382
24,"i saw scanteak bed frames like not bad, but their cupboards really cmi..",2016,0.269,0.731,0.0,0.397
25,eh i dun like scanteak sell dun sell in a bundle. everything individual. ask for a dining set with 4 chairs and 1 bench table 1.6m cost 2477. can die.,2016,0.085,0.782,0.133,-0.34
26,their tv consoles pretty neat too.,2016,0.608,0.392,0.0,0.7351
27,scanteak???,2017,0.0,1.0,0.0,0.0
28,second hand is a good option otherwise ikea and scanteak sell affordable solid wood frames,2021,0.412,0.588,0.0,0.7717
29,"i am looking for a teak wood wardrobe... so far saw one at scanteak and i'm wondering if there are any (preferably better) alternatives? checked many teak wood seller websites and they don't sell wardrobes... most of them sell tv consoles, dining tables or bed frames. any suggestion or alternative would be greatly appreciated. thanks!",2016,0.122,0.878,0.0,0.7943
30,can try widharja. did you check out tan boon liat building? a couple of furniture shops there.,2016,0.0,1.0,0.0,0.0
31,"if you are a fan of teak wood, there's actually two scanteak outlets at balestier. one at pegu road while the other is nearer to the thomson medical side.",2015,0.078,0.922,0.0,0.3182
32,"can try mylatex, scanteak's latex, etc. got people ordered from malaysia and send it over in previous page.",2018,0.0,1.0,0.0,0.0
33,how much for queen size,2018,0.0,1.0,0.0,0.0
34,"if solid wood is best, maybe companies like scanteak and their direct competitors should set up new department specialising in hifi stands.",2020,0.304,0.696,0.0,0.8074
35,"err, i'm talking about racks bro.. a simple stand made of wood will be a terrible idea. the wooden stands have a complex construction. you don't need a special tv rack, but the materials do make a difference. hi fi racks are built for solidity, and also circulation.",2020,0.0,0.918,0.082,-0.3977
36,"checking out picket rail what about brands like castlery,fortytwo?",2016,0.238,0.762,0.0,0.3612
37,"oh hong liang. we spent more time with the nice lady at aik leong. will check out hong liang. today we spent some time at this place called wihardja, selling mainly teak furniture. anybody bought from them? their pieces seems interesting and cheaper compared to scanteak, but quality probably not as good.",2016,0.067,0.877,0.056,-0.0923
38,"getha is full latex afaik and that makes it very expensive and maybe very soft. you don't need full latex, you can have a latex top with spring, that should shave the cost by half. different brands will use different springs with different firmness. there are many brands but of course which is a good brand using really pure latex is another question. more affordable brands are scanteak, maxcoil, mylatex, tilamking, etc.",2018,0.072,0.928,0.0,0.6428
39,so does getha full latex price range belong in the same category as mylatex since it's also my-based? the major difference between mylatex tara series is like half the price of eb's heveya series.,2018,0.07,0.93,0.0,0.3612
40,scanteak ish goot quality!!! i oso jin tempting.,2016,0.0,1.0,0.0,0.0
41,"where did you people buy your dining table and study table? i was initially eyeing a dining table from acebed but they no longer sell them. luxuriant furnishing's stainless steel table was something my wife like but too ex and not happy with warranty on tempered glass. maybe will have to switch to nova or starliving for their tables. more affordable. for study table, maybe scanteak. they have some fair this weekend in henderson road with some discount.",2016,0.073,0.847,0.08,-0.1523
42,"quote from the internet: plywood is comprised of glued layers of hardwood about 3/32 thick. it will usually be 7 to 9 layers so that its final thickness is about 3/4 inches. when exposed to medium to high levels of moisture, plywood will experience little warping. it also can be exposed to moisture cycles (low to high repeatedly) without showing significant warping or swelling. of course if your kitchen is in a humidity controlled environment, then fluctuations in humidity may not be pose a problem. for ""fine"" furniture, solid wood is preferred when the beautiful wood grains are exposed. you get to play around with woodworking joinery methods, nails and screws are usually avoided... getting to choose your preferred kind of wood etc when you go to the usual solid wood furniture places like scanteak (lowrange) or condehouse (highend), things to note is the workmanship or craftsmanship*, open and close the drawers, run your hands and caress the tabletop... this image has been resized.click to view original image",2016,0.094,0.863,0.043,0.8769
43,2m too long will cockblock my door lol 175cm max there's only 1 table that is 170cm at ikea but its dining table lolol... just gonna settle with bekant 160cm...need decide l or straight,2020,0.124,0.876,0.0,0.5023
44,"gxgx bro! not bad so many stuffs for only $1.7k+ actually there's one scanteak at paya lebar only, u shld shun bian go there as well.",2016,0.186,0.814,0.0,0.6419
45,scanteak one dining set will be abt 1.7k liao,2016,0.0,1.0,0.0,0.0
46,yolo~ here 1.7k like $17.,2016,0.385,0.615,0.0,0.3612
47,i already aim their bed frame for masterbed room lol... $1399 pm if you need pre wedding photography! hardwarezone forums app,2016,0.0,1.0,0.0,0.0
48,"tried slumber land's arcadia and marisa. heard they are the new models. the latex top is a mixture of wool, don't know why, don't like,got what infra red technology which sounds like gimmicks. price is around 1.7k. went to tilamking, their 4 inchlatex plus pocket spring is 1.7k, feel is okay. there's another ergo range, it's 1.1k iirc, the firm type. feels good for me but i don't like pu foam. went to scanteak, they have their own latex and a german brand. their latex is from malaysia. got one mattress with about 3in thick of latex with spring, is 1.4k. price imo is acceptable but don't know why feel it's too soft. they also have full latex. 6 in iirc is $2.4k, 8 in is 2.9k. they have this german brand the sales claim to be very green and good but pu foam how can it be healthy. went to google but can't find any info about that german grand and technology. heard firm mattresses are for 85kg and above. any good brands for latex plus spring? can't find my latex anywhere and their website don't even reply. is there any place to try near central or south sg? i don't want memory foam or pu because they degas toxic.",2018,0.155,0.839,0.006,0.9844
49,try dreamland mattress? latex. made in msia. bot 1 in tradehub21 there,2018,0.0,1.0,0.0,0.0
50,"tried them at hn and quite pricey, not sure if it's pure latex top, don't feel so to me for those in the affordable range. mattresses are suppose to be replaced once every 6-8 years. so not sure if you really wish to fork that amount every time. research shows that replacing the mattress regularly provides the best support to the back as the mattress will sag or the springs will lose its dexterity. i was looking for latex top too, scanteak was selling at $14xx, tilamking $17xx. 65% of the rubber in the world comes from south east asia, the rest mostly from asia like india and vietnam. don't make sense to me to get an european brand for latex, most likely they will need to import the latex, process then export, adds up to cost for nothing. malaysian or indonesian brands are cheap and good, lucky singapore happen to be right beside both of them.",2018,0.125,0.834,0.041,0.9266
51,"hi! i have been happy go lucky see see look look at this moment till top. had visited furniture mall at beach rd (note: all shops would be shifting to akira building this year soon), trade hub 21 at boon lay way, ikea alexandra. brand names like scanteak has good lasting sofas and solid bed frames. weiken.com interior design offer plenty of ideas. so why not go jalan jalan first and get some fresh ideas. i will share with you all any new places of interest if i find any.",2012,0.228,0.772,0.0,0.9642
52,"hi there thanks alot for sharing ideas & place of interest... wow.. went ""shopping""/jalan jalan around liao... great ideas to look around to find new ideas.. scanteak: pretty good... if you're fan of solid wood furnitures... we have a few piece of furnitures from them ourselves for years liao.. ec/condo showroom: we can also pop to some of the ec/condo showroom to get some ideas too.. even if their floorplan & design maybe not suitable for trivelis size but then you can still try to pick up some small bits & pieces of ideas here & there too.. something to share with: bedframe it's better to get a soild wood bedframe as you don't want to have yr bed crash down the floor in the middle of the night while you're sleeping.. this happen to one of my friend's little kid where whole bed collapse in the middle of the night.. lucky their dog is not under the bed that time if not sure gone case...",2012,0.121,0.815,0.064,0.8006
53,"scanteak, tilam king and many brands have latex top, just that most cost at least two times more.",2018,0.096,0.904,0.0,0.2023
54,any particular reason why you got tilam king as compared to carson or other alternative you tried?,2018,0.0,1.0,0.0,0.0
55,any recommendations for king bed frame divan style non storage with flat base around 1.5k or less? went scanteak didn't like the look of their frames.,2019,0.0,0.922,0.078,-0.2755
56,"our offline purchases as the saying says.... bbbmtl! (buy buy buy mai tu liao!) especially when there is a sale... since there is not much of a difference if you buy now or later... since there is a sale... might as well! especially if it is a necessity and not want for your new home. for furniture, since ours a mainly a scandinavian theme, we go for mostly pencil leg furniture... which makes our living space looks bigger. tip: - sign up for robinson ocbc card, it will be very useful especially the additional 5% cash rebates + close door sales for members! - takashimaya vouchers is very valuable as it has no expiry date! so store it for your new home purchases! any other vouchers like robinsons voucher also very valuable to save further for your home needs purchase. furnitures: 1. comfort design furniture - http://www.comfortfurniture.com.sg/ we find their prices slightly more competitive than castlery. quality wise is still very decent for this price. we bought our sofa set, dining table set (bench + 2 chairs), small coffee table. 2. scanteak - http://www.scanteak.com.sg/ this is more of a want... as i quite love the solid build of their furniture, so decided to splurge on their bed frame for the master bedroom and also a small sturdy table that is on sale to hold my dry cabinet of my precious camera equipment. 3. muji - http://www.muji.com.sg/ my wife love their stand mirror (full length), since we got a $30 313 voucher which we got from the purchase of a sony tv, might as well! 4. robinsons - http://robinsons.com.sg/ we missed out on their black friday sale to purchase their simmons backcare 4 series mattress which goes as low as $3.2k after discounts and members rebate as my friend's card limit wasn't enough, and that pushes me to go apply the card myself lol. we placed a $200 deposit with robinson bedshop (look for sheila if you want to purchase simmons mattress) at their heeren branch. this effectively locks their price (which ever is lower when there is a promo). so as of now we are still waiting for their additional 10% card member rebate... we also bought loads of other stuffs which i will cover later below. 5. inkagu - https://www.inkagu.com/products/shin-ju-mattress always see their special price mattress ad on facebook and since it cost only $299... so bbbmtl, this is for our guestroom. 6. ki-mono - http://www.ki-mono.net a pity they are closing down... they have very nice japanese theme furnitures which we can match our scandinavian theme. we bought a rack for kitchen use and also a clothe rack at very attractive closing down sale price. appliances: 1. sony store @ 313 just happens so... my buddy's wife works at sony so yes! we can get staff price. bought sony tv kdl-55w800c at $1.2k+! cheap right? 2. heritage bathroom gallery ironically we didn't buy any bathroom stuffs from them but bought from them a fujioh hob & hood set and bosch oven ($50 cheaper than other shops we went!). 3. gain city initially we wanted to buy our electrolux washing machine & dryer from paris silk but they cannot hold stock for us too long... so in the end we went to gain city to buy from them. price slightly higher than what was quoted by paris silk. 4. tim wong (aircon) from renotalk - for our mitsubishi starmex (2 tick) air con 5. mega discount (kallang leisure park) - https://www.megadiscountstore.com.sg/ initially we are eyeing a hitachi or mitsubishi refrigerator but after the sales person show us what a samsung fridge can do and the build quality + door test... we are sold! just hope that it doesn't *chibaboom* later! lol 6. robinsons used my wife's vouchers ($350) to buy zojirushi induction heating rice cooker np-hbq10 which is at promotion price $489 but we only paid $139! got a free rice stocker as well. 6. philips carnival sale (once a year!) bought some stuffs during the sale last year, steam garment iron + iron + toaster + kettle. 7. aosbath - https://www.aosbath.com/ bought a 40l digital model storage heater (ao smith) for convenience and electricity savings. 8. ht lighting (johor bahru, permas jaya) - http://www.htlightings.com/ bought ceiling fan aeratron ae3 50' light oak color for 1480rm, sg selling this for $1099 sgd! if anyone need their sales contact number (via whatsapp) to check price before going in to buy let me know! others: 1. hansgrohe we bought a bundle deal during their warehouse sale last year october. we was given a 25% voucher which we went to buy additional tap and shower set for the common toilet. 2. robinsons too many things to buy here especially kitchen use... le creuset, wmf, corelle, lock & lock, bodum, bedsheets etc during their member or public sale! we also make use of my wife's citibank redemption of robinson vouchers as well. i also got my ns voucher which i am keeping to buy the simmons mattress haha 3. takashimaya i accumulated $230 voucher prior to this... bought a tefal air fryer on promotion at $279... so we only paid $49 for it lol 4. ikea bought their pull out cabinet to be integrated with our kitchen cabinet. also bought accessories for kitchen use. 5. hoe kee they are the only one carrying blanco brand for kitchen sink in sg, so not much of a choice! 6. big bath (johor bahru) -http://www.bigbath.com.my/ since we went to ht lighting to buy ceiling fan, drop by here to bought some bathroom accessories from them, automatically given discount without asking haha. let me know if you need any details of our purchases above. too many purchases to go into detail here",2017,0.091,0.895,0.015,0.9969
57,bought all these in a set from scanteak.1.8k. very expensive.,2016,0.0,1.0,0.0,0.0
58,hi do you know exactly where is the shop in alexandra village selling mylatex? thx!,2018,0.166,0.834,0.0,0.4199
59,"getha only sell pure latex. i tried mylatex at a shop in imm, it's inside this shop that sells a lot of furniture. scanteak also has a latex top and iirc it's selling at ard sgd1500. latex + springs should be around below $2k. pure latex is around 3k onward, depending on how thick is the latex.",2018,0.034,0.966,0.0,0.2023
60,"i read that there is another brand of full latex mattress: willow mattress, any review on this? besides scanteak and castlery bedframes, i also found out about this namu wood furniture, anyone bought from there before?",2019,0.0,1.0,0.0,0.0
61,"hi bro, willow is 18cm/7"" thick. hard time finding that info, its under the faq subsection. for a thailand made latex 7"" at 2449 for queen, very very very very over priced.. at that price point rather get the belgium made. i personally think thailand made full latex are very similar to malaysian made, considering bro calkel bought getha 30cm at similar price point.... no reason to get willow. namu wood seems to have good reviews on google too.",2019,0.036,0.919,0.045,0.0772
62,"scanteak, commune",2021,0.0,1.0,0.0,0.0
63,"scanteak dining table chair. tough and good. 6 years still going strong, and no dandruff(flaking) problems like those ""gaming"" chairs. ;-)",2017,0.355,0.432,0.213,0.6486
64,"just peasant nia... my only luxury in the house is my simmons mattress, scanteak bed frame, hansgrohe shower set... the rest all normal normal",2016,0.0,1.0,0.0,0.0
65,"actually i start to wonder that testing long enough may also not tell much. because if your existing bed is of a specific kind of firmness and you are used to the positioning. when the bed you try is somehow very different in its support and texture. one may feel uneasy and dismiss as it's not suitable. when i first got the latex mattress, i initially tot that the old one felt more comfy. overtime, the body used to it liao. i kind of regret though, because i couldn't find mylatex to try initially. i bought the tilamking one. if i could choose again, i would had tried the full latex ones first before deciding. not that i mean tilamking one is not good though, i think they are very well made. just that the price is not far from a mylatex's full latex. you can find the mylatex range here http://myaerofoam.com/en/collections/mylatex/ take note the range sold in sg maybe different but the above link can give you a rough idea what to expect. if i'm not wrong, most full latex can flip, meaning you can use for a longer time. better verify with the sales regarding this. the scanteak one imo is very soft and it's not even talalay. i think more to do with the spring resistance. if you are very light, maybe it's better.",2018,0.065,0.91,0.025,0.8758
