,Body,Year,Positive,Neutral,Negative,Compound
66,"depends on which part of the house you want to set up. in china and india, i still see ppl using solid wood. in taobao, some shops will tell you the natural finishing they use. not sure are they reliable though. scanteak all these sell solid wood furniture. if you really need to buy in sg those rtm cheaper solutions. particleboard release the most voc, followed by plywood then butcher blocks. rattan wood furniture are strong and good, not expensive. imo they are very good for sofa frames. kitchen is harder but kitchen should always be airy, those fumes from stir frying, braising all release carcinogens to the air. that's why many house wives got cancer. maybe the kitchen top use tiles or stainless steel. most contractors cut cost by using the cheapest material.",2015,0.102,0.808,0.09,-0.4851
67,that means no custom carpentry cabinate for kitchen and also wardrobe? since most of the time the carpentry use either soft plywood or hard ply wood. the voc from plywood is from the chemical use to process of glue the plywood together?,2015,0.0,0.91,0.09,-0.4515
68,if u like wooden one can go scanteak see see but request for a flat base,2019,0.119,0.881,0.0,0.1901
69,"unfortunately due to heighten demand, most of the work chairs and tables are marked up quite a fair bit. i recently got a chair from progress health (orthoseries iv)for my work from home purpose. i was fine with my old scanteak chair back then, but prolong sitting with the computer table being slightly elevated makes it uncomfortable after few months of working from home. the chair certainly help bumping up the seating height and arm rest. if you can wait, then perhaps wait for the 9:9 sales to get one.",2020,0.122,0.812,0.066,0.6593
70,today went scanteak buy dining table and chairs. whole set 1.8k.,2016,0.0,1.0,0.0,0.0
71,peekture please!,2016,0.722,0.278,0.0,0.3802
72,"good mattress is one without memory foam especially not on the top (because of heat and voc, webmd says not suitable for babies too), the more funny layers there is the more foam you are getting so the more easier to sag. general natural latex full or with pocket spring is best desired. cooling natural fabric is good. cooling gel on top is no good (chemicals) many asking about jb mylatex's full latex but like nobody bought any, got one bro bought from sg on qoo10 the tara model, shop name is medalion (maybe spell wrong). to skip mylatex carson (search few pages back to know why) good place to search for mattress and furniture is furniture mall and imm. in imm you will also find the maxcoil shop that alot of bros here bought the jardin or royal brilliance. myself included. it is better to buy the frame with the mattress as there is normally package deal. if you buying wooden frame make sure there is no gaps at the base aka slatted base. popular for wooden frame i think is scanteak and castlery. ++ attention bros that haven't payment finish at the imm maxcoil shop, other than grabpay now they accept paywave. used my uob ppv for 1k deposit. 4000 miles into pocket",2019,0.18,0.791,0.029,0.9883
73,thx bro. appreciate the post. btw are memory foam really that bad even if there's some cooling material on top? i using memory foam pillow and they are quite comfy. not sure how it would feel on the entire body. looks like i've gotta make a trip to imm.,2019,0.168,0.726,0.106,0.3603
74,"i went to a showroom before, 1.8k for a latex hybrid. i will avoid such hybrid. latex is already cooling and natural, why bother with these types of blended material that mix latex with other fillers to lower the cost. besides being cooling, latex is natural and release almost no toxic fume. getting synthetic material is defeat the purpose. not only mylatex, can try scanteak, tilamking, maxcoil, etc. no need to be too obsessed with the brand. i don't see alot of ergonomics in mattress that can fit everyone and every sleeping position. i think the firmness of the spring will play a more important role. different body weight will require different firmness.",2018,0.098,0.761,0.141,-0.5035
75,"actually latex is just a premium material as in less voc, more cooling, etc. it don't really mean the support is better. i will suggest a firmer bed. a full latex bed might not be recommended since it's quite soft. even my 3 in latex top, imo is too soft. maybe 2 inch with lesser latex padding and closer to some firm springs might do me better. i will personally suggest that you go try all the latex + spring, those sea brands should cost less than 2k. then see which one is firmer, as in your butt won't sink in as much and curl you back too much. brands that were mentioned here, are mylatex, bayshop, tilam king, magic coil, scanteak, etc. if you are sleeping with a spouse, who might suffer from a bed that is too stiff instead. you may want to put a bamboo mat on your side, cheap solution, but it works.",2018,0.066,0.91,0.023,0.5478
76,"novena , full house , vhive , courts furnitures quite sianzzz wan. u never look scanteak? but they have too much wood based design so not suitable for me.",2016,0.0,1.0,0.0,0.0
77,"their storagebed is one of the best i have seen so far, but i didn't buy it as i am thinking to reuse my old frame. it is generally cheaper to buy with a bundle. if u plan to go with storage can go with theirs. however whether u want a hydraulic storage bed is entirely dependent on whether u have the use for the space below, some say its easier to get frames with leg for easy cleaning under the bed. personally i rather not have legs so won't see don't see and no need to clean lol... but if ur furnishing requires wooden frame then u have to look elsewhere, most peeps would go to scanteak castlery etc to find wooden frames, there's a lack of those in imm if u are interested in one. most importantly remember whatever frame u buy always get one without gaps at the base which is very common in wooden frames. even if it is fully wrapped with leather or fabric try to press and feel if it is slatted under the exterior. if u get slatted base ur warranty will likely be voided base on experiences of many.",2019,0.121,0.864,0.015,0.966
78,saw this king koil ultrapedic plush for 1.9k (queen) including customizable (non-storage) bed frames. was told 'hotel feel'. seems like a good deal? just that the bed frame doesn't really match with the id. was thinking if should check out scanteak mattresses too and bed frames instead.,2014,0.109,0.891,0.0,0.6597
79,all cmi one. might as well get the day bed from scanteak.,2016,0.16,0.84,0.0,0.2732
80,happy can liao. u build a home sweet home for ur self. so u must satisfied the things u buy and design.,2016,0.395,0.605,0.0,0.8683
81,"wow! finally someone who went to all the shops i went to. for dormiente, was the one you tried the one where u could split the mattress into the male and female one? i remember the 18cm version was their classic range. the lady actually introduced the 23cm range with the horsehair? for me as she said i was slighty heavier (90kg heavy to german company meh... ) you are right to say 18cm is on the thin side though but i would say with a full latex mattress that is unlikely to affect the feel or performance of the mattress. from her explanations i also heard they had a coconut coir version used in their firmest bed, if u were looking at that version, i would strongly suggest going without the coconut (again) with european bedding i was actually looking at heveya 1, the one with only 1 layer of latex. this solely based on my personal logic that if i do use different layers of latex they must be varying densities which makes my money less worthwhile if i get lower density one . i remember this is 19cm high, still abit low. but the price range also on the lower side. i ultimately decided with european bedding over dormiente as i done some research online and found that the latexco company was alot more renown and seems to be the largest latex mnc that even have plants in usa. i was also slightly skeptical about the horse hair on the dormiente tbh. at the imm shop, actually i tried the maxcoil relaxer which was their latex mattress first and that was what i shortlisted. it didn't have the fanciful 7 zone latex like the 2 brands neither was it organic latex (although i personally think natural is enough, organic probably doesn't matter since not food..) but the price also more attractive obviously. this one was a 25cm so actually more good height for us. the very friendly guy then told us to try the royal brilliance, said it was their best selling model. if u followed my post u would have known for i actually only look at full latex mattress... but eventually the feel of the mattress was good and convincingly enough that the 4"" of latex at the top is good enough (this time i was called average weight hahahahah). more importantly the latex is also made by latexco so they were actually similar to what i saw at european bedding, plus the info presented on the mattress were similar. honestly if u ask me, i would only choose between the heveya 1 and royal brilliance. (my wife doesn't like the maxcoil relaxer for unknown reasons). u would have seen another bro chaos that had booked the relaxer but seems his partner also like royal better ************************************ as for hilker, i do remember searching on it being a malaysian company licensed from the germans. so the price doesn't make sense at all. for the frame, i would reccomend not getting from dormiente or european bedding. afterall they are latex producers not wood company... u may be better off with scanteak or castlery etc for wooden frames? any idea btw if the aussino is like the old aussino or they sell completely diff stuff now? think they disappeared for a long time",2019,0.16,0.808,0.032,0.9978
82,oh yes and our long talk on frames shouldn't have slatted base and how someone's full latex mattress sagged on a wooden slatted frame.... hahahhaa. by the way scanteak actually offers to change their wooden slat base into a full piece of ply. just for anyone's info,2019,0.058,0.942,0.0,0.4019
83,"for getha peeps, i got a transforme plush written as full latex. do check out of course. there is a full latex block as well, but damn soft, we sleep, macam sink in. mine is full but of different density.",2019,0.038,0.828,0.134,-0.6059
84,why not teak? :p,2019,0.0,0.596,0.404,-0.2584
85,bro just curious. any reason why you didn't consider getha or mylatex?,2019,0.173,0.827,0.0,0.3182
86,"for dormiente, i was not served by the owner but a new salesman who just joined the company. the 18cm one is indeed the one which has 1 side each for male and female. i was also introduced to the 23cm one which i think is the one u mentioned it with the horsehair. it seems to be more comfortable but it is around 2k more than the classic range. for european bedding, we didn't tried heveya 1 as the sales person (i think he is a part-timer) mentioned it is typically for younger crowd, so we only tried heveya 2 and 3. for hilker, i tried to google and it seems to be a legit german company but they do have cooperation partners in malaysia and taiwan. i guess we probably have to go back try again as it can get really confusing when buying a mattress. overall, we were quite impressed by the sales person from hilker, dormiente (tho he is relatively new to the company but not the industry) and unispring. they seem to be very knowledgeable and also taught us what to look out for when selecting a bed and not hardselling or pushy. we will probably drop by scanteak and castlery as the price of the bed frames seem to be more reasonable. kind of strange tho that both dormiente and european bedding selling bed frames with slatted based (tho the gaps for slatted base may be smaller than the usual slatted base in other wooden frames) i wonder now if it is easy to find eu queen bed frames and bedsheets in singapore . i have not been to the aussino store at hbf so can't really comment much. lastly, @pacificstorm and fellow forumers, thanks for sharing, have learnt quite a lot from all the posts in this thread.",2019,0.075,0.899,0.026,0.9518
87,"nice to see your response bro. for the european bedding, i am guessing maybe the part timer wanted more commission so push the more ex heveya 2 and 3. didn't had this issue when i was there. in fact comparing heveya 1 which was 19cm of full latex, the 18cm at dormiente would be obsolete base on the part timer's logic, which obviously wasn't the case. in fact i am quite sure with 18 or 19cm it is more than adequate to withhold my weight, i think i wasnt even using any more than 2 inches of the latex (in terms of depression into the mattress) did u also try the maxcoil relaxer by any chance? i feel it felt quite similar to the firm one i tried at dormiente. though it seems most people preferred royal brilliance instead... as for hilker, if u went to their website u would see they are manufactured under hilker sdn bhd, did some googling and it pointed to the following links below. apparently they are under a licensing right of the germany company but made by a factory that produces a few different brands in malaysia. their pricing would be more relevant if it was german made like dormiente, but i don't think it would be reasonable to pay for a ""royalty or licensing"" fee made in malaysia. https://buy.ramcreditinfo.com.my/index.php/search/malaysia-company/1109958/hilker-malaysia-sdn.-bhd the malaysian factory that licenses different brands, https://www.luxurysleep.com hope to hear from you again",2019,0.077,0.899,0.024,0.8906
88,"i like the bedframe in pomelo (tan boon liat building) my current bedframe is kinda old, but since it is still working, then maybe still save money lor.",2016,0.195,0.805,0.0,0.7227
89,"most companies use the dunlop vulcanization method for producing the latex, not that there are no synthetic material used but the chance is lesser. more or less, there should be some stabilisers. even if there's any, i reckon that it will still be better than memory foam or high density foam made out of petroleum, which also traps the most heat. all i can see from the online description for mylatex is they label as fully natural with nothing synthetic for most range. their price is the cheapest and they been around for quite some time. of course, how true are their words will be up to you to decide. that easyhouse website is the cheapest but i could also find such prices from a brick and mortar shop at alexandra village. i've tried mylatex from a shop at imm, their prices are pricey. scanteak and tilamking also have latex top range. there are also brands like getha, dormiente, etc. you can check those out if you want. mylatex seems to sell via reseller network, don't expect those sales staff's knowledge to be much.",2018,0.107,0.885,0.008,0.9586
90,"hi guys reading through the thread, will probably go for latex plus spring. read that the more affordable brands are tilam king, mylatex and scanteak. going through their websites, they have many different ranges and products. so just wondering if theres specific range i should look at.. looking at a king size bed. firmness i will do a physical test to assess which works best..",2018,0.0,1.0,0.0,0.0
91,"yeah sometimes life gets in the way too.. but if you can afford it, bite the bullet.. your total expenditure will be lesser if you went for quality now.. eg u buy ikea furniture now, dont like cos it doesnt age well and feels cheap.. u buy a replacement set from scanteak... should just go to scanteak from day one.. (not saying scanteak is quality, its just relative, feel free to scale accordingly) you save the initial outlay for ikea furniture, the time spent fretting over it, the new shopping efforts, and the new moving and disposal efforts (your time isnt free) edit: some people like the long term project aspect.. best to go with what feels right to you, and within your means of course",2021,0.116,0.83,0.054,0.891
92,"hmm, best bet is to get it custom ba... can start with those neighbourhood carpentry shops i heard my colleague got custom builds from scanteak though.. maybe can check with the shop? i agree with not choosing ikea... seems good at the start because cheap.. but after a while u end up looking for replacements because it looks cheap.. bite the bullet and get something bespoke, at least you will be happy with the finish",2021,0.145,0.855,0.0,0.8847
93,scanteak?,2021,0.0,1.0,0.0,0.0
94,"i bought from one of those chain stores like scanteak maybe 15 years ago when i moved house. its very heavy as it is wooden, and i also like very high beds so my bed + the thick mattress also makes it very high. so i have the same problem as you, but im quite happy with it.",2020,0.15,0.819,0.031,0.7986
95,"my parents got excellent wedding gifts. all these are almost 40 years old: 1) takahi slowcooker. it only has three settings - off, high, auto. 2) zojirushi boiler with only boil and warm settings. i'm not certain how healthy it is to use such an old boiler but we're not dead yet so... 3) le creuset pot that looks good as new. we baby it though. various scanteak furniture that are 20+ years old. still solid despite our v rough treatment (e.g. water stains, scratches). surprisingly, a star living junior wardrobe made of shitty material has lasted us almost 30 years. it's refusal to break down = uncle still using a kiddy pastel blue wardrobe. we stack 10kg luggages on the thing all the time and it's still perfectly fine? i hate it so much.",2020,0.161,0.755,0.084,0.9006
96,where did you get a sofa cover from? i have a sofa from scanteak with removable covers. the fabric is starting to 'ball up'.,2019,0.0,1.0,0.0,0.0
97,this is such an underrated household item. only i'd suggest getting solid wooden ones. plastic ones might crack due to uv/heat exposure. i have an old school stool from a primary school science lab that i use as my nightstand and another new one from scanteak. endlessly useful.,2019,0.095,0.905,0.0,0.5423
98,"if you said scanteak, i might agree. don't see a resemblance to ikea furniture.",2019,0.185,0.815,0.0,0.3612
99,"scanteak, my family has been using that brand since forever. they have a showroom at katong that you can go down and take a look and try their different beds.",2019,0.0,1.0,0.0,0.0
100,"got most of my stuff from commune, castlery, hipvan, etch and bolts, born in colour and scanteak! if you like marble, can consider martlewood amd greyhammer too. the tan boon liat building also has many furniture stores",2018,0.072,0.928,0.0,0.4199
101,scanteak? there are non mdf table in ikea but it cost hundreds of dollars for a small one.,2018,0.0,1.0,0.0,0.0
102,[scanteak?](https://www.scanteak.com.sg/dining/tables.html),2018,0.0,1.0,0.0,0.0
103,"im looking for a good quality wardrobe. looked at scanteak and wasnt exactly impressed (only the doors are teakwood). ikea quality really cui. went around some old-school neighbourhood furniture stores and found some seemingly decent ones, but i was wondering if anyone here have other recommendations?",2017,0.043,0.918,0.039,0.0446
104,scanteak,2017,0.0,1.0,0.0,0.0
105,according to google maps there's a scanteak opp. king albert park mrt. and the view on the right (overhead bridge) seems to match the google street view. this is probably king albert park mrt's bus stop.,2017,0.0,0.939,0.061,-0.296
106,not sure if king albert park is the right place. i know there's a scanteak place nearby. please correct me if you know the place. please keep an eye out for these pets if you're near the area!,2017,0.123,0.828,0.049,0.446
107,scanteak is pretty successful too,2016,0.7,0.3,0.0,0.7906
108,does anyone know any more big places like ikea to find furniture with similar style in sg? e.g. scanteak/picket and rail thanks!! specifically looking for the warehouse outlets to view more furniture under 1 roof!,2016,0.17,0.83,0.0,0.7608
