,comments,Positive,Neutral,Negative,Compound
546,Crowded on weekends but wide selection and friendly staff! Sets on display are limited but got the feeling that staff are pushing us to visit their online store which has much more selections. Pleasant experience will come visit again for new ideas and products!,0.23266666666666666,0.748,0.019333333333333334,0.4378
547,Great experience at the store.  The staff was helpful and friendly and look forward to enjoy the sofa and dining table.,0.45999999999999996,0.54,0.0,0.7364999999999999
548,"Good, friendly and professional staff help us around at the store.",0.512,0.488,0.0,0.8126
549,Really pretty studio and the staff is very helpful!,0.496,0.504,0.0,0.7832
550,Great overall service. Price is reasonable or good quality products.,0.483,0.517,0.0,0.49305
551,Great service. Polite and helpful staff,0.6435,0.35650000000000004,0.0,0.5232
552,Excellent service with good design considerations shared. Ivy was most patient and attentive to our needs. Very nice furniture with flexible combinations too. Highly recommended!,0.472,0.528,0.0,0.44267500000000004
553,"Good concept but poor execution. Recently purchased a castlery mattress and after only 6 months of suffering, had to bite the bullet and buy a new, better quality one. I’ve had cheap mattresses in the past, from places such as IKEA, but …",0.10433333333333333,0.6990000000000001,0.19666666666666668,-0.19276666666666664
554,Great place to shop and friendly staff,0.593,0.407,0.0,0.8074
555,Great store with great selection. Staff was extra friendly and very helpful and patient!,0.6085,0.3915,0.0,0.806
556,We drop by Castlery to check out some furniture. And end up getting the whole set. Everything was so nice. Staff was friendly and efficient. Sales person Samira attended to us and she was very patient and help us with our purchase. Will definitely come back for more shopping! Thank you castelery for the amazing experience!,0.32457142857142857,0.6457142857142857,0.029714285714285714,0.38271428571428573
557,"Had a leisurely shopping experience and once we had shortlisted Miki did the convincing, the purchase was seamless.",0.144,0.856,0.0,0.4019
558,"Great experience! Really cool showroom and set up.

Staff is really friendly and helpful throughout the entire visit",0.5353333333333333,0.4646666666666667,0.0,0.6004
559,Very nice and cozy studio for furniture shopping. Amazing quality and selection. Staffs are friendly too! I definitely recommend coming down to the studio rather than just buying online.,0.43625,0.56375,0.0,0.559825
560,Pleasant service staff that are very helpful and patient in their explanations and recommendations. Furnitures are good quality and set at reasonable price points too.,0.274,0.726,0.0,0.55565
561,"Was here to look for sofa.. met the sales personnel, nice and friendly, given us great help on how we should choose and how to manage the delivery. Overall a great experience at Castlery.",0.427,0.573,0.0,0.7701
562,We were served by Ivy and are very please with her service quality. The sofa we have purchased is also of very good quality. Thumbs up!,0.132,0.868,0.0,0.2668333333333333
563,"Great showroom, polite and experienced sales staff, extremely helpful. Highly recommended.",0.5920000000000001,0.40800000000000003,0.0,0.5366
564,"Showroom is super pretty with great service. The Todd sofa was a perfect fit for our house. You may mix and match the configuration, fabric and colour.",0.4023333333333333,0.5976666666666667,0.0,0.5464333333333333
565,"I like the designs wor. If you like rustic theme, can come here wor.",0.34650000000000003,0.6535,0.0,0.3612
566,Absolutely beautiful furniture. Cosy and stylish showroom. Samirah the relationship manager is polite and very helpful. AAA experience.,0.23900000000000002,0.761,0.0,0.277875
567,Experience has been excellent at the studio and left with a brand new Adams sofa set for delivery next week.,0.171,0.829,0.0,0.5719
568,"Super hassle free experience! Loved the showroom, Shaun and Nikki were super helpful as we were choosing our furniture. Come visit to see the items in real life!",0.41933333333333334,0.5806666666666667,0.0,0.5694
569,The experience was good. The customer service officer assist me in getting the sofa that i am looking for and she is very efficient and good.,0.34550000000000003,0.6545000000000001,0.0,0.5334
570,"Bought a bed frame, a book shelf, a set of dining chairs, and 2 bar stools, all great quality products, and service is top notch.  Thanks",0.6185,0.3815,0.0,0.575
571,Very friendly and helpful kind assistance rendered by staff Anson.,0.587,0.413,0.0,0.8737
572,Hello Castlery team! Thank you so much Ivy for efficient and wonderful service! Products are superb and well displayed. Really happy with the experience. :),0.5356,0.4644,0.0,0.5314
573,Had a great experience buying furnitures from Castlery. The team helped me make smart decisions with thoroughness in approach and fantastic service. Thank you Castlery.,0.43533333333333335,0.5646666666666667,0.0,0.5763666666666667
574,Hats off for the exemplary service! Very welcoming and knowledgeable staff. Helped me with my interior design plans too; Definitely beyond my expectations. Castlery did set the bar!,0.16025,0.83975,0.0,0.22365000000000002
575,"Not a big space but the modern, well designed furniture are nicely displayed. Air conditioned arear. Pleasant visit lasting 30 minutes or so. Friendly staff",0.37775000000000003,0.62225,0.0,0.4406
576,Got good deal on black Friday!!! Friendly and helpful staff.,0.5765,0.4235,0.0,0.62065
577,"Amazing selection of modern looking furniture, coupled with excellent customer service",0.455,0.545,0.0,0.8176
578,"Quality & value for money products. Contemporary & modern designs. Their staffs, like Din was well versed & very attentive towards customers.Kudos to Din & Castlery!!",0.16625,0.58375,0.0,0.23457500000000003
579,Great collection and high quality furniture. The staff is very helpful. Highly recommend.,0.541,0.459,0.0,0.5068
580,The selection of furniture on discount is much better than I thought. I am so happy with my buys.,0.3345,0.6655,0.0,0.52595
581,"Friendly staffs, good service.",0.74,0.26,0.0,0.6908
582,Beautiful and diverse furniture pieces that are contemporary and functional. Staff here are friendly and helpful as well! Will definitely be back and highly recommend :),0.522,0.478,0.0,0.7473333333333334
583,Beautiful showroom with excellent selection. Nikki was very helpful and friendly with good product knowledge. Overall an excellent experience,0.611,0.389,0.0,0.7456333333333334
584,It was a smooth and fuss free experience purchasing our sofa and dining table here. Nikki was friendly and very informative!,0.3065,0.6935,0.0,0.52585
585,Thank you Castlery. Very helpful sales support offering excellent product  knowledge.,0.6085,0.3915,0.0,0.6144000000000001
586,"Love the store ambience, sales assistant is also very helpful and friendly. Great place to shop for modern design and affordable furniture!",0.42400000000000004,0.5760000000000001,0.0,0.7632000000000001
587,"Great and helpful services, reasonable prized furnitures.",0.72,0.28,0.0,0.8834
588,Nice and Pleasant service. Patience and willing to offer advise how to match the furniture.,0.3765,0.6234999999999999,0.0,0.36345
589,Great service and definitely will be going back to complete the house.,0.405,0.595,0.0,0.7783
590,Warm accompany employee. Designs are nice and pricings matches quality.,0.40249999999999997,0.5975,0.0,0.32389999999999997
591,Friendly service provided. Product is nice!,0.611,0.389,0.0,0.48460000000000003
592,"Even though we took a while to decide on our purchases, Sylvia was patient and understanding. She took the initiative to explain the details of each product and even helped us look for other matching products.",0.0,1.0,0.0,0.0
593,Pleasant shopping experience with going online to narrow down what we'd like and then a visit to the showroom which has most of the items stocked in. Very helpful staff!,0.41200000000000003,0.5880000000000001,0.0,0.61235
594,Great selection of competitively priced furniture! And a overall an awesome experience simply because of the warm welcome by the people inside the showroom.,0.4295,0.5705,0.0,0.7495
595,Nice and huge showroom with many of its products on display. The furnitures and accessories are minimalistic in design suitable for any home design.,0.181,0.819,0.0,0.31245
596,"Beautiful furniture and very good service that’s neither too pushy nor disinterested - good balance of space, product information and help.",0.483,0.517,0.0,0.9186
597,service is very excellent. with one look & the assistance from the sales lady i confirmed my sofa less than 10 mins . happy with the product .,0.37433333333333335,0.6256666666666667,0.0,0.3944666666666667
598,"Received excellent customer service at Casterly, the customer service agent was very informative. The moment I walked into the store I was greeted with professionalism and the  quality of service in helping me make my decision was …",0.2065,0.7935,0.0,0.54125
599,Good customer service and nice range of products,0.469,0.531,0.0,0.6486
600,It was a stress free purchase at the store. We were in a hurry and Angela was very helpful and her recommendations met our requirements! We placed our order in less than 30 mins in the store. Looking forward to receive our new sofa!,0.117,0.82525,0.05775,0.1631
601,Really enjoyed the shopping experience at Castlery. Great customer service by Sylvia. Would definitely recommend!,0.5756666666666667,0.42433333333333334,0.0,0.6169333333333333
602,The sales team was extremely helpful in helping us select a sofa for our family living room.,0.284,0.716,0.0,0.6764
603,"Came to buy a sofa set from Castlery, exactly the same one which my daughter had bought from Castlery 2 years ago! Like it so much! In addition, Alan was more than happy and patient with us to answer our queries. Will be back for more!",0.17575,0.82425,0.0,0.257375
604,"Good warm experience, and polite and helpful staff services. Feel confident and assured of after-sales service(hope will not be disappointed).",0.4665,0.5335,0.0,0.71295
605,"Good experience browsing the showroom. We were served by Nikki, she was very nice while serving us",0.302,0.698,0.0,0.4183
606,Lovely place with many type of beautiful designs. Staff is extremely helpful. Found a few items that were unique and really pretty. Would recommend to others.,0.45725000000000005,0.54275,0.0,0.55125
607,the sofa is comfortable. the service staff is polite and knowledgeable. we are pleased with the service provided and the varieties available over in the store.,0.232,0.768,0.0,0.317
608,Staff know the information well. Items are all on display. Parking accessible across the road.,0.11466666666666665,0.8853333333333333,0.0,0.09106666666666667
609,Nice design and resonable price.,0.412,0.588,0.0,0.4215
610,Wide variety on display. Great service and friendly staff.,0.3545,0.6455,0.0,0.4037
611,Good customers service. Staffs have good products' knowledge.,0.47050000000000003,0.5295,0.0,0.3612
612,I like the studio showroom experience. Very comfortable to browse and try out the furniture. The customer service is also very friendly and helpful. My wife and I were able to decide on a 3 seater sofa.,0.29475,0.7052499999999999,0.0,0.419875
613,"Friendly customer service, not pushy.
nice roomy environment to walk around",0.4925,0.5075000000000001,0.0,0.5178499999999999
614,"Nice showroom, furniture are interesting and practical. Good service. Bought myself 2 Ralph Armchairs. All the best.",0.47875,0.52125,0.0,0.41715
615,Castlery sells really good quality furniture and fits the theme of our house as well!,0.285,0.715,0.0,0.6352
616,Good service from Ivy here in castlery! Really helpful and friendly. The range of furniture is pretty good too. Probably find what you are looking for here in castlery.,0.39275,0.6072500000000001,0.0,0.468175
617,Sales Rep was very helpful and assisted us in finding the right fit of sofa.We were extremely pleased with the service and quality of the sofa too. Thank you! Will come back for more,0.33466666666666667,0.6653333333333333,0.0,0.41696666666666665
618,"nice design and good price.
friendly staff",0.7005,0.2995,0.0,0.57125
619,"Pleasant Experience, staff is very friendly and patient with our questions. They will try to help us to resolve whichever concerns that we have on the furniture. Will definitely find them again for our furnitures in the future.",0.306,0.694,0.0,0.6094333333333333
620,The selection of discounted items is very attractive and wide for me to fill my family home with beautiful pieces.,0.328,0.672,0.0,0.807
621,Good furniture designs at affordable price,0.333,0.667,0.0,0.3612
622,Good shopping experience with knowledgeable sales team and support.,0.426,0.574,0.0,0.6369
623,Great customer service with good looking salespeople haha. I love the spaciousness of the showroom and overall layout - very chic and contemporary vibes.,0.488,0.512,0.0,0.7713000000000001
624,"Innovative wood look with stylish finishing at affordable price.
feel like worth buying :)",0.5265,0.4735,0.0,0.5955
625,"Amazing experience with everyone at Castlery especially Nevil, who has been very helpful and knowledgeable in recommending pieces for my new home. Beautiful, clean lines furniture .....highly recommended!!",0.333,0.33366666666666667,0.0,0.5369666666666667
626,great selection of furniture and cushions,0.451,0.549,0.0,0.6249
627,The showroom is really great in providing ideas for home. The staff is also very helpful in answering queries,0.3035,0.6965,0.0,0.5672
628,Great selection and service. Many options and customizations possible. fast delivery.,0.19233333333333333,0.8076666666666666,0.0,0.2083
629,Sylvia was very helpful and had great recommendations.  The quality and craftsmanship of Castlery's furniture are top notch.  This is our second purchase from them and will be our first consideration in future purchases.,0.23733333333333334,0.7626666666666666,0.0,0.33463333333333334
630,"High quality furniture, attended by pleasant sales person. Nice experience.",0.5285,0.47150000000000003,0.0,0.46605
631,"Visited Jit Poh showroom today. Bought sofa set, dining chairs and a sideboard. Big showroom with full range of products on display. Designs are nice and modern. We were attended by Nikki who is very courteous and professional. She can give …",0.11266666666666666,0.8873333333333333,0.0,0.16296666666666668
632,Great selection and nice staff!,0.706,0.294,0.0,0.8016
633,Looking for a bed frame for my new house and a staff gave me good advice!,0.177,0.823,0.0,0.4199
634,"The staff are very friendly and helpful. The furniture are worth the price, suitable for minimal, Scandinavia and industrial style of interior design. The snug mattress is very comfortable, definitely worth the price! Will come back for more furniture!",0.3105,0.6895,0.0,0.45740000000000003
635,Service was prompt. It was an extremely pleasant shopping experience. Sales lady serving us gave us ample space to shop and browse at our own pace.,0.125,0.875,0.0,0.18543333333333334
636,Nikki has been very helpful and patient to assist. Love the design of the furnitures.,0.3345,0.6655,0.0,0.48465
637,Great shopping experience at Castlery with the help of Sylvia. Great quality furniture at reasonable prices. Highly recommended for those who are looking for some great furniture for your home!,0.42033333333333334,0.5796666666666667,0.0,0.7200333333333333
638,nice showroom and they welcoming us very well. Good job to the customer service samirah. will come back!,0.304,0.696,0.0,0.3857333333333334
639,Good store with all options,0.385,0.615,0.0,0.3612
640,"Great Service from Sylvia.
The Hudson bed looks awesome!",0.55,0.44999999999999996,0.0,0.64185
641,"Broad choice of furniture, very friendly service, would definitely recommend.",0.554,0.446,0.0,0.8268
642,"We bought a new sofa for 2.7k. When washing the cushion covers, 2 of them where used and dirty. We complained and almost 2 months later they haven’t been able to replace them. They do have great design, but clearly they don’t control all the steps of their production and outsource somewhere. Watch our for the quality of the items.",0.0528,0.8654,0.0818,-0.02308
643,Great and comfortable showroom! They definitely have something for everyone here.,0.552,0.44799999999999995,0.0,0.61435
644,Pleasant service and nice showroom! Products here are also nice designed. Love it,0.6006666666666667,0.3993333333333333,0.0,0.5551333333333334
645,Plunged into getting yellow Doris bench during the 11.11 sale even though it is really risky with a 2 year old at home cos the mustard yellow is too pretty to resist!,0.104,0.834,0.062,0.3397
646,Is a very nice experience and cosy place to shop. The staff are helpful with our questions,0.2985,0.7015,0.0,0.44845
647,Love the customer service and din was great,0.549,0.451,0.0,0.8074
648,Excellent variety of designs colours and sizes,0.381,0.619,0.0,0.5719
649,Store is packed with furniture to suit many different themes. Designs are great and affordable. Customer service is top notch and Friendly. I've bought a couple of things for my home and this place is certainly in my top few choices to buy …,0.29875,0.70125,0.0,0.4328
650,"Great service from Ivy, she was really helpful with the suggestions and delivery timeframes. The showroom at Jit Poh is comfortable and much bigger than expected.",0.303,0.6970000000000001,0.0,0.6561
651,"Good selection of on trend furniture with budget friendly price; wonderful customer service by Sylvia
A",0.439,0.561,0.0,0.8555
652,Nice ambience with excellent service by the staff here,0.481,0.519,0.0,0.7579
653,Great staff (Sylvia) helping us through buying process! Love the store and the environment here too!!,0.2856666666666667,0.381,0.0,0.43516666666666665
654,"I ordered a set of Maru Dining Plates for my steak and salmon during the circuit breaker which was a stressful period for me. The plates looked elegant and were durable.

Highly recommended.",0.3393333333333334,0.6133333333333333,0.04733333333333333,0.07923333333333332
655,Nice furniture with lots of woody feel. Great customer service from staff at their physical store in Tanjong Pagar! :),0.5343333333333333,0.4656666666666667,0.0,0.5130333333333333
656,Contemporary Design at Affordable price range. Comfortable to sit. Good Customer Service.,0.393,0.607,0.0,0.2906
657,"My experience with the customer team has been good, they are patient and understanding with my fickle mind on selecting the furniture.",0.106,0.894,0.0,0.3612
658,Jacob is very friendly and helpful and Castlery has a wide variety of dining chairs and coffeetable choices that suit our needs. Highly recommended.,0.467,0.533,0.0,0.5168
659,"Benson nice intro for the products, thank you",0.469,0.531,0.0,0.6486
660,Shout out to Ivy from Castlery for her attentive & good services. Furniture & design wise is great and very much fulfill our design home theme of Scandinavian/Industrial.,0.332,0.668,0.0,0.6233
661,My mom & I had a pleasant experience at castlery today. Eric Chia provided us very helpful tips in our sofa selection. He was very patient and attentive to our request. We really appreciate your time and accommodating to our queries. This really made a difference. Thank you.,0.2533333333333333,0.7466666666666667,0.0,0.3008
662,"Wide variety and up to date furnishings, suitable for any concepts n themes of your abode. Most Reasonable price!

Staff has good ideas and recommendations and surely knows their product well.

Highly recommend that you go to their showroom, talk to the staff to have a feel of what they have to offer.",0.14450000000000002,0.8555,0.0,0.2945
663,Great service and very comfortable sofas. Incredibly wide range and great value for money furniture. Highly recommended!!!!!!!!,0.28475,0.46525,0.0,0.396175
664,"Selling modern furniture which I find is of good value looking at the quality. The huge showroom is nicely decorated, gives a nice cosy feel. Definitely worth visiting",0.554,0.446,0.0,0.6491333333333333
665,Excellent service . Manager Samirah is helpful and knowledgeable about the products. The show rooM layout is spacious and relaxing.,0.45333333333333337,0.5466666666666666,0.0,0.49576666666666663
666,"Got served by a salesperson named Shawmann, service was good and his recommendation suited us well! Would recommend you guys to look for him if you have any enquiries :))",0.21700000000000003,0.7829999999999999,0.0,0.47975
667,Served by Eric. He was good and helpful.,0.3195,0.6805,0.0,0.3243
668,"Excellent service. Nice furnitures too.
Thanks Ivy for the help!",0.6776666666666666,0.32233333333333336,0.0,0.5674
669,"Beautiful ambience, excellent customer service",0.717,0.283,0.0,0.8225
670,I love this place and my new cushion,0.348,0.652,0.0,0.4939
671,"Furniture selection was good. The staff at the showroom are very helpful,
they helped to match accessories to the furniture and assist with a flexible delivery date.",0.3275,0.6725000000000001,0.0,0.48635000000000006
672,"Smooth buy, recommended",0.474,0.526,0.0,0.2023
673,The sales staff that attended to us was very attentive and helpful. His name is Eric. We are very happy to have gotten our sofa ☺,0.18366666666666667,0.8163333333333334,0.0,0.36060000000000003
674,Love the range of quality products here. Can't wait to receive our furnitures 🤩,0.174,0.8260000000000001,0.0,0.24695
675,Highly recommended to shop here as the staff especially Din whom is very helpful throughout the process. Surely will come back again! 🙂,0.23366666666666666,0.433,0.0,0.37596666666666667
676,Great furniture and excellent staff! We always found something we love!,0.5705,0.4295,0.0,0.6925
677,Hugh range of furniture to select from and great customer service. Very patient with our questions and provides very helpful suggestions.,0.27349999999999997,0.7264999999999999,0.0,0.55015
678,"Had finally decide to purchase the Alfie 2 seater left and right and make it 4 four seater sofa. Staff at showroom was very helpful especially Ivy, for assisting us with the purchase. Highly recommend to consult the friendly staff to make an informed choice.",0.189,0.811,0.0,0.3977333333333333
679,"Friendly costumer service, I was managed to buy the sofa set and dining table I like in just 2 hours time. Will recommend to my friends",0.457,0.5429999999999999,0.0,0.6858
680,Sylvia helped us through out the choosing of our sofa and dining table. She advised us on what product to use and where to purchase the fabric protector for future use on our purchased sofa. Great and friendly service from Sylvia. Thanks!,0.4115,0.5885,0.0,0.325
681,The showroom was very nice and the service was good!,0.424,0.576,0.0,0.7082
682,Excellent service - Din went above and beyond to assist. 👍🏼,0.158,0.8420000000000001,0.0,0.28595
683,"Great service and friendly people, the store space is open and relaxing. Very easy to imagine what would work well in your home.",0.454,0.546,0.0,0.76815
684,Great and prompt service.,0.577,0.423,0.0,0.6249
685,Found this shop online and were surprised that there are also shops to visit! Jacob did a great Job at their Jit Poh store and support us with know how and his experience! Friendly atmosphere and nice showroom with everything we first saw …,0.29333333333333333,0.7066666666666667,0.0,0.6028333333333333
686,Castlery is definitely one of my first choice with good design and friendly staff especially Ivy who served us 👍🏻👍🏻,0.331,0.669,0.0,0.8126
687,Shopping at Castlery's showroom is a great experience where the furniture displays are well put together and the staffs are very helpful. Bought a sofa here which is really comfortable and value for money.,0.375,0.625,0.0,0.79565
688,Had good time looking the furniture and very nice design.,0.411,0.589,0.0,0.6801
689,Nightmare started when I wanted to purchase a replacement seat cushion for the sofa I purchased with them. Initial delivery was mid Sep but suddenly received delayed notice for mid-late October. Nightmare customer service only via chats …,0.0,0.9453333333333334,0.05466666666666667,-0.1097
690,Ivy was very helpful and friendly. She helped in our design concept within our budget. Overall we are pleased with the shopping experience.,0.30466666666666664,0.6953333333333334,0.0,0.4008
691,Awesome service! Great shopping experience! :),0.834,0.166,0.0,0.5921333333333334
692,"Visited Castlery today and it was a good experience with my wife. we love the sofa that we purchase. we were assisted by a very friendly staff, Angela. Thank you for accommodating us.",0.3165,0.6835,0.0,0.4394
693,Good customer service and great product quality! Best in the town!,0.59,0.41000000000000003,0.0,0.7268
694,Big and nice showroom. Helpful and friendly customer service,0.575,0.42500000000000004,0.0,0.56995
695,Great customer service and lovely showroom!,0.672,0.328,0.0,0.8478
696,"Good customer service, staff are friendly. I can get what I like.",0.5215,0.47850000000000004,0.0,0.526
697,"Clean, modern designs available in well-designed showroom!!",0.1665,0.3335,0.0,0.2287
698,Beautiful furniture. Helpful staff.,0.7665,0.23349999999999999,0.0,0.5104500000000001
699,Great service from Ivy! Good experience coming into the store to browse and have a look around in a nice environment.,0.44199999999999995,0.558,0.0,0.6537
700,Best place to get your customisable sofas in SG!!,0.18,0.32,0.0,0.3348
701,Overall a pleasant buying experience with great options for sofas and patient staff who take time to explain your options. Easy comfortable place to browse and buy furniture.,0.40549999999999997,0.5945,0.0,0.7738499999999999
702,Lovely experience at the store. Very helpful and patience staff.,0.4615,0.5385,0.0,0.53065
703,Great place to shop for furniture,0.451,0.549,0.0,0.6249
704,Good service. Model of the furniture is very modern.,0.357,0.643,0.0,0.1806
